{
  "group": { "entity": { "id": "g-1", "type": "group" }, "name": "g-1" },
  "leader": { "entity": { "id": "player-A", "type": "player" }, "name": "Вася" },
  "members": [
    { "entity": { "id": "player-A", "type": "player" }, "name": "Вася", "participation": "active" }
  ],
  "cause": "create"
}
